"feature_id","角色域","一级功能","二级功能","三级功能","四级功能","功能说明","优先级","版本","状态","页面路由","来源PRD","验收要点","备注"
"OPS-009","交付运维后台","健康巡检","巡检任务","巡检执行","/","运维查看和执行客户健康巡检任务","P2","Beta2","后置","/ops/inspection /ops/inspection/:runId","1-prd-det/运维支持后台-PRD.md","巡检任务有结果、异常和处理建议","自动巡检后置"
"OPS-010","交付运维后台","健康巡检","巡检规则","规则配置","/","运维配置健康巡检规则和自动建单规则","P2","Beta2","后置","/ops/inspection/rules","1-prd-det/运维支持后台-PRD.md","规则可启停并关联告警或工单","依赖监控规则引擎"
"OPS-011","交付运维后台","客户档案","客户运维档案","SOP 记录","/","运维沉淀客户环境、历史问题、处理记录和 SOP","P1","Beta1.1","后置","/ops/customers/:tenantId","1-prd-det/运维支持后台-PRD.md","客户档案能关联工单和配置变更","Beta1 先用工单详情承接"
"AGT-001","代理镜像站","代理工作台","管理员首页","经营概览","/","代理管理员查看客户、订单、余额、待办和经营指标","T0","Beta1","已有原型","/agent/admin","1-prd-det/代理镜像站-PRD.md","代理可看到经营概览和关键待办","当前项目已有代理入口"
"AGT-002","代理镜像站","客户管理","代理客户","客户列表","/","代理管理员查看代理名下客户和开通状态","T0","Beta1","已有原型","/agent/admin/tenants /agent/admin/tenants/:id","1-prd-det/代理镜像站-PRD.md","只能查看本代理范围客户","强制 agent_id 数据隔离"
"AGT-003","代理镜像站","订单财务","订单与账单","代理订单","/","代理管理员查看名下客户订单、付款和开通状态","T0","Beta1","已有原型","/agent/admin/orders","1-prd-det/代理镜像站-PRD.md","订单列表和详情能关联客户与销售","对公审核视角色配置"
"AGT-004","代理镜像站","订单财务","对公审核","代理对公","/","代理或平台代理财务处理代理客户对公付款审核","T0","Beta1","已有原型","/agent/admin/orders/bank-transfer-review","1-prd-det/代理镜像站-PRD.md","审核通过后能触发客户开通链路","权限边界需明确"
"AGT-005","代理镜像站","工单","交付工单","代理交付","/","代理管理员查看代理客户交付工单和支持工单","T0","Beta1","已有原型","/agent/admin/delivery-tickets /agent/admin/support-tickets","1-prd-det/代理镜像站-PRD.md","工单按代理范围隔离","可复用运维工单组件"
"AGT-006","代理镜像站","销售管理","代理销售","销售账号","/","代理管理员管理代理内部销售账号、客户归属和状态","T0","Beta1","已有原型","/agent/admin/sales /agent/admin/sales/:id","1-prd-det/代理镜像站-PRD.md","可新增、停用销售并查看名下客户","内部销售分佣另行配置"
"AGT-007","代理镜像站","线索管理","咨询留资","代理线索","/","代理管理员查看镜像站产生的咨询留资并分配销售","T0","Beta1","已有原型","/agent/admin/leads","1-prd-det/代理镜像站-PRD.md","留资进入代理范围并可分配","与官网公共池区分"
"AGT-008","代理镜像站","佣金分成","佣金规则","代理规则","/","代理管理员配置代理内部分佣或查看平台分成规则","P1","Beta1.1","已有原型","/agent/admin/commission/rules","1-prd-det/代理镜像站-PRD.md","规则可被佣金流水引用","复杂多级分佣后置"
"AGT-009","代理镜像站","佣金分成","提现流水","交易查询","/","代理管理员查看提现或分佣交易流水","P1","Beta1.1","已有原型","/agent/admin/commission/transactions","1-prd-det/代理镜像站-PRD.md","流水状态、金额和订单来源可查","提现审批需财务联动"
"AGT-010","代理镜像站","进货余额","进货与余额","代理余额","/","代理管理员查看余额、进货充值和客户开通扣减","T0","Beta1","已有原型","/agent/admin/balance","1-prd-det/代理镜像站-PRD.md","余额变动与客户开通扣减可追溯","代理特色能力"
"AGT-011","代理镜像站","站点管理","网站管理","镜像站配置","/","代理管理员维护镜像站基础信息、品牌和获客入口","P1","Beta1.1","已有原型","/agent/admin/website","1-prd-det/代理镜像站-PRD.md","镜像站配置可保存并预览","真实域名绑定后置"
"AGT-012","代理镜像站","营销工具","代金券管理","代理券","/","代理管理员发放和管理代理客户可用代金券","P1","Beta1.1","已有原型","/agent/admin/coupons /agent/admin/coupons/:couponId","1-prd-det/优惠券系统-前端Mock-PRD.md","券能按客户、金额和有效期管理","与平台券规则需统一"
"AGT-013","代理镜像站","组织权限","员工账号","代理员工","/","代理管理员管理代理员工账号和基础角色","T0","Beta1","已有原型","/agent/admin/staff","1-prd-det/代理镜像站-PRD.md","可新增员工并分配角色","权限矩阵后置"
"FIN-001","财务侧","财务工作台","仪表盘","财务待办","/","财务查看待对公复核、待开票、佣金和提现待办","P1","Beta1.1","已有原型","/finance/dashboard /agent/finance/dashboard","1-prd-det/财务佣金结算-PRD.md","财务待办能跳转到明细页面","Beta1 可先由官方后台承接"
"FIN-002","财务侧","订单财务","企业与订单","财务只读","/","财务查看企业、订单、发票和开通进度","P1","Beta1.1","已有原型","/finance/tenants /finance/orders /finance/orders/invoices","1-prd/PRD.md","财务能按订单和企业查询","数据权限应受限"
"FIN-003","财务侧","订单财务","公账汇款审核","到账确认","/","财务复核或处理公账汇款审核","P1","Beta1.1","已有原型","/finance/orders/bank-transfer-review","1-prd-det/客户开户注册与席位激活流程-PRD.md","审核结论能更新订单状态","Beta1 由官方后台先承接"
"FIN-004","财务侧","佣金结算","佣金规则","规则查看","/","财务查看或维护佣金规则","P1","Beta1.1","已有原型","/finance/commission/rules","1-prd-det/财务佣金结算-PRD.md","规则变更可追溯","角色分工待确认"
"FIN-005","财务侧","佣金结算","提现流水","提现处理","/","财务查看提现流水并处理审核状态","P1","Beta1.1","已有原型","/finance/commission/transactions /finance/commission/review","1-prd-det/财务佣金结算-PRD.md","提现记录有状态、金额和处理人","真实支付出款后置"
"FIN-006","财务侧","佣金结算","结算批次","批次管理","/","财务生成和确认佣金结算单","P1","Beta1.1","已有原型","/finance/commission/batches","1-prd-det/财务佣金结算-PRD.md","批次金额与流水可核对","首版可只读"
"API-001","API 与开放能力","API 密钥","密钥列表","Key 生命周期","/","客户管理员查看 API Key 列表、状态、创建时间和最近调用","P1","Beta1.1","已有原型","/tenant/api-keys","1-prd-det/客户侧API密钥管理台-PRD.md","列表可筛选并进行启停删除操作","外呼计费 MVP 依赖"
"API-002","API 与开放能力","API 密钥","创建密钥","权限范围","/","客户管理员创建 API Key 并设置名称、环境、权限范围和限额","P1","Beta1.1","已有原型","/tenant/api-keys","1-prd-det/客户侧API密钥管理台-PRD.md","密钥明文只展示一次并提示保存","安全策略需后端强制"
"API-003","API 与开放能力","调用记录","使用记录","请求日志","/","客户管理员查看 API 调用记录、费用、状态码和 request_id","P1","Beta1.1","待实现","/tenant/api-usage","1-prd-det/客户侧API密钥管理台-PRD.md","可按 Key、服务、时间和结果筛选","路由尚未在 appRoutes 中注册"
"API-004","API 与开放能力","服务目录","模型与服务","服务价格","/","客户管理员查看可调用服务目录、Endpoint 和计费单价","P1","Beta1.1","待实现","/tenant/api-services","1-prd-det/客户侧API密钥管理台-PRD.md","服务目录能展示调用路径和价格","需与模型页面口径统一"
"API-005","API 与开放能力","渠道状态","服务渠道","可用性状态","/","客户管理员查看对客 API 渠道和底层服务状态","P2","Beta2","待实现","/tenant/api-channels","1-prd-det/客户侧API密钥管理台-PRD.md","渠道异常时能提示影响范围","依赖真实网关监控"
"API-006","API 与开放能力","计费扣费","外呼按次计费","余额扣减","/","系统按 API 调用次数生成扣费流水并校验余额不足","P1","Beta1.1","待实现","无前端或嵌入账单页","1-prd-det/客户侧API密钥管理台-PRD.md","成功调用生成 request log 和 billing ledger","按分钟计费后置"
